description	price	prime	url	stars	num_reviews
ASUS DUAL NVIDIA GeForce RTX 4060 OC Edition Scheda Grafica, 8 GB GDDR6 128-bit 17 Gbps PCIE 4.0, GPU Tweak III, DUAL-RTX-4060-O8G	346,00	False	https://www.amazon.it/ASUS-GeForce-Grafica-128-bit-DUAL-RTX-4060-O8G/dp/B0C8JT7K1M/ref=sr_1_5?keywords=gpu&qid=1699106662&sr=8-5	4,5	48
Gigabyte NVIDIA GeForce RTX 3060 GAMING OC V2 Scheda grafica - 12GB GDDR6, 192-bit, PCI-E 4.0, 1837MHz Core Clock, RGB, 2x DP 1.4, 2 x HDMI 2.1, NVIDIA Ampere - GV-N3060GAMING OC-8GD	327,00	False	https://www.amazon.it/Gigabyte-GeForce-3060-GAMING-V2/dp/B096Y2TYKV/ref=sr_1_6?keywords=gpu&qid=1699106662&sr=8-6	4,7	1.127
Nuwo Scheda Video RX580 AMD RADEON RX 580 2048SP, 8 GB GDDR5, 256 bit, 1284MHz, Scheda Grafica GPU per PC Gaming, DVI, HDMI, DisplayPort, PCI Express 3.0 x16, Supporta DirectX 12, Bulk	109,90	True	https://www.amazon.it/Nuwo-1284MHz-Grafica-DisplayPort-Supporta/dp/B0CDQ78HWC/ref=sr_1_7?keywords=gpu&qid=1699106662&sr=8-7	3,9	15
MSI Radeon RX 6650 XT MECH 2X 8G OC Scheda Video - AMD RX 6650 XT, GPU 2447/2669 MHz, 8000 MB di Memoria DDR6, Velocità di Memoria 17500 MHz, Bus di Memoria 128bit	285,54	False	https://www.amazon.it/MSI-Radeon-6650-MECH-GDDR6/dp/B09YHXT12P/ref=sr_1_8?keywords=gpu&qid=1699106662&sr=8-8	4,5	2.018
ASUS Dual AMD Radeon RX 6600 V2 Scheda Grafica, 8 GB GDDR6 128-bit 14 Gbps PCIE 4.0, GPU Tweak III, DUAL-RX6600-8G-V2	250,31	False	https://www.amazon.it/ASUS-Radeon-Grafica-128-bit-DUAL-RX6600-8G-V2/dp/B0BRYR7QPV/ref=sr_1_9?keywords=gpu&qid=1699106662&sr=8-9	4,4	31
MSI GeForce RTX 4060 GAMING X 8G Scheda Grafica - RTX 4060 GPU, 8GB GDDR6 (17Gbps/128-bit), PCIe 4.0 - TWIN FROZR 9 (2 x TORX Fan 5.0), RGB - HDMI 2.1, DisplayPort 1.4a	370,04	False	https://www.amazon.it/MSI-GeForce-GAMING-Scheda-Grafica/dp/B0C7WCKXB6/ref=sr_1_10?keywords=gpu&qid=1699106662&sr=8-10	4,7	218
Nuwo Scheda Grafica GT730 NVIDIA GeForce GT 730, 2 GB DDR3, 128 bit, 700MHz, Scheda Video GPU a Basso Profilo per PC Gaming, DVI, HDMI, VGA, PCI Express 2.0, Supporta DirectX 11, Bulk	49,90	True	https://www.amazon.it/Nuwo-Grafica-GeForce-Profilo-Supporta/dp/B0C6MZ6QMQ/ref=sr_1_11?keywords=gpu&qid=1699106662&sr=8-11	4,3	34
ASUS TUF Gaming AMD Radeon RX 6500 XT OC Edition Scheda Grafica, AMD RDNA 2, PCIe 4.0, 4GB GDDR6, HDMI 2.1, DisplayPort 1.4a, Ventole Axial Tech e Doppi Cuscinetti a Sfera, GPU Tweak II, Nero	179,65	True	https://www.amazon.it/ASUS-Grafica-DisplayPort-Ventole-Cuscinetti/dp/B09PRRQ3QC/ref=sr_1_12?keywords=gpu&qid=1699106662&sr=8-12	4,1	76
Asus Dual NVIDIA GeForce RTX 3060 V2 OC Edition Scheda Grafica, 12GB GDDR6 192-bit 15 Gbps PCIE 4.0, GPU NVIDIA Ampere, DUAL-RTX3060-O12G-V2	334,94	False	https://www.amazon.it/ASUS-GeForce-Grafica-192-bit-DUAL-RTX3060-O12G-V2/dp/B096658ZWP/ref=sr_1_13?keywords=gpu&qid=1699106662&sr=8-13	4,7	1.145
ASUS Phoenix AMD Radeon RX 550 Scheda Grafica, 4GB GDDR5, PCIe 3.0, HDMI, DisplayPort, DVI-D, Resistenza Alla Polvere IPX5, Ventole con Doppio Cuscinetto a Sfera, Tecnologia Auto-Extreme, Nero	112,78	True	https://www.amazon.it/ASUS-DisplayPort-Resistenza-Cuscinetto-Auto-Extreme/dp/B089WFBK4H/ref=sr_1_14?keywords=gpu&qid=1699106662&sr=8-14	4,6	239
ASUS Dual NVIDIA GeForce RTX 3050 V2 OC Edition Scheda Grafica, 8 GB GDDR6 128-bit 14 Gbps PCIE 4.0, GPU Tweak III, DUAL-RTX3050-O8G-V2	258,62	True	https://www.amazon.it/ASUS-GeForce-Grafica-128-bit-DUAL-RTX3050-O8G-V2/dp/B0BY6XKC5K/ref=sr_1_15?keywords=gpu&qid=1699106662&sr=8-15	4,4	4
ASUS Dual AMD Radeon RX 6750 XT OC Edition Scheda Grafica, AMD RDNA 2, PCIe 4.0, 12GB GDDR6, HDMI 2.1, DisplayPort 1.4a, Ventole Axial Tech, Doppi Cuscinetti a Sfera, Tecnologia 0dB, Nero	407,90	True	https://www.amazon.it/ASUS-Grafica-DisplayPort-Cuscinetti-Tecnologia/dp/B09YJ222L6/ref=sr_1_16?keywords=gpu&qid=1699106662&sr=8-16	4,1	141
MAXSUN GeForce GT 730 - Scheda Video Nvidia GPU da 4 GB per computer PC Scheda Grafica 128 bit DDR3 ITX Design PCI Express DVI-I, HDMI, VGA	82,99	False	https://www.amazon.it/MAXSUN-GeForce-Design-Express-grafica/dp/B097GMQWRN/ref=sr_1_17?keywords=gpu&qid=1699106662&sr=8-17	4,2	93
ASUS Dual NVIDIA GeForce RTX 4070 OC Edition Scheda Grafica, 12 GB GDDR6X 192-bit 21 Gbps PCIE 4.0, GPU Tweak III, DUAL-RTX4070-O12G-WHITE	702,01	True	https://www.amazon.it/ASUS-GeForce-Grafica-192-bit-DUAL-RTX4070-O12G-WHITE/dp/B0C1T4NSFB/ref=sr_1_18?keywords=gpu&qid=1699106662&sr=8-18	4,7	28
XFX VGA RADEON RX 6600 SPEEDSTER SWFT 210 8GB GDDR6	219,00	False	https://www.amazon.it/XFX-SPEEDSTER-RADEON-grafica-RX-66XL8LFDQ/dp/B09HHLX543/ref=sr_1_19?keywords=gpu&qid=1699106662&sr=8-19	4,6	2.510
MSI GeForce RTX™ 4060 Ti VENTUS 3X 8G OC, Scheda Video Gaming - Memoria 8GB GDDR6 ( 18Gbps/128-bit), PCI Express® Gen 4 x 16, DisplayPort x 3 (v1.4a), Torx Fan 4.0, HDMI 2.1a, Zero Frozr	474,00	False	https://www.amazon.it/MSI-GeForce-VENTUS-Scheda-Gaming/dp/B0C4F9HCF6/ref=sr_1_20?keywords=gpu&qid=1699106662&sr=8-20	4,4	121
ASUS DUAL AMD Radeon RX 7600 V2 OC Edition Scheda Grafica, 8 GB GDDR6 128-bit 18 Gbps PCIE 4.0, GPU Tweak III, DUAL-RX7600-O8G-V2	316,58	True	https://www.amazon.it/ASUS-Radeon-Grafica-128-bit-DUAL-RX7600-O8G-V2/dp/B0C6B3147Z/ref=sr_1_21?keywords=gpu&qid=1699106662&sr=8-21	4,4	4
MSI GeForce RTX 4070 VENTUS 2X 12G OC, Scheda Video Gaming -Memoria 12GB GDDR6X (21 Gbps/192-bit), PCI Express® Gen 4, DisplayPort x 3 (v1.4a), Boost clock 2505 MHz,TORX Fan 4.0, HDMI 2.1a	639,00	True	https://www.amazon.it/MSI-GeForce-Memoria-Express%C2%AE-DisplayPort/dp/B0BYZJWDNC/ref=sr_1_22?keywords=gpu&qid=1699106662&sr=8-22	4,6	451
Scheda grafica da gioco ZOTAC GEFORCE RTX 3060 Twin Edge da 12 GB GDDR6	318,00	True	https://www.amazon.it/Scheda-grafica-gioco-ZOTAC-GEFORCE/dp/B08WRF18SC/ref=sr_1_23?keywords=gpu&qid=1699106662&sr=8-23	4,5	235
luoshaPUCY Supporto Scheda Grafica GPU Supporto in Alluminio, Supporto Scheda Video Verticale Brace Regolabile, Reggi Scheda Video, Sostegno GPU, Nero	8,99	False	https://www.amazon.it/luoshaPUCY-Supporto-Alluminio-Verticale-Regolabile/dp/B0BVH6ZKL2/ref=sr_1_24?keywords=gpu&qid=1699106662&sr=8-24	4,6	55
Gigabyte NVIDIA GeForce RTX 4060 GAMING OC Scheda grafica - 8GB GDDR6, 128-bit, PCI-E 4.0, 2550MHz Core Clock, 2x DP 1.4, 2x HDMI 2.1a, NVIDIA DLSS 3 - GV-N4060GAMING OC-8GD	377,90	True	https://www.amazon.it/Gigabyte-NVIDIA-GeForce-GAMING-grafica/dp/B0C8ZS7N73/ref=sr_1_25?keywords=gpu&qid=1699106662&sr=8-25	4,6	20
EZDIY-FAB GPU VGA PCIe 8 pin U Turn 180 Gradi Angolo Connettore Scheda Adattatore di Alimentazione per Scheda Grafica Desktop Tipo Inverso 3Pack	11,99	False	https://www.amazon.it/EZDIY-FAB-Connettore-Adattatore-Alimentazione-Grafica/dp/B096VB8MB5/ref=sr_1_26?keywords=gpu&qid=1699106662&sr=8-26	4,6	660
Scheda Grafica RX 580, Scheda Grafica GDDR5 da 8 GB 256 Bit con GPU 1284 MHz, 60 Hz 4K, PCI Express 3.0, 2 Ventole di Raffreddamento, Interfaccia DP HDMI DVI D	140,87	True	https://www.amazon.it/Grafica-Express-Ventole-Raffreddamento-Interfaccia/dp/B0B8Q724XQ/ref=sr_1_27?keywords=gpu&qid=1699106662&sr=8-27	3,8	54
ASUS NVIDIA GeForce GT 730 Scheda Grafica PCIe 2.0, Memoria DDR3 2 GB, Raffreddamento Passivo, Auto-Extreme, GPU Tweak II, Grigio	72,14	True	https://www.amazon.it/ASUS-GeForce-Grafica-Raffreddamento-Auto-Extreme/dp/B0BHDVLWJQ/ref=sr_1_28?keywords=gpu&qid=1699106662&sr=8-28	4,6	5
XFX SPEEDSTER QICK319 RADEON RX 6750XT CORE Gaming Scheda Grafica con 12GB GDDR6 HDMI 3xDP, AMD RDNA™ 2 (RX-675XYJFDP)	379,00	False	https://www.amazon.it/XFX-SPEEDSTER-QICK319-Grafica-RX-675XYJFDP/dp/B0B34M1YLW/ref=sr_1_29?keywords=gpu&qid=1699106662&sr=8-29	4,6	654
ASUS ROG Strix NVIDIA GeForce RTX 4090 OC Edition Scheda Grafica, 24 GB GDDR6X 384-bit 21 Gbps PCIE 4.0, GPU Tweak III, ROG-STRIX-RTX4090-O24G-WHITE		False	https://www.amazon.it/ASUS-GeForce-Grafica-384-bit-ROG-STRIX-RTX4090-O24G-WHITE/dp/B0BPYY5JBB/ref=sr_1_30?keywords=gpu&qid=1699106662&sr=8-30	4,6	21
ASUS TUF Gaming NVIDIA GeForce RTX 4070 OC Edition Scheda Grafica, 12GB GDDR6X 192-bit 21 Gbps PCIE 4.0, GPU NVIDIA Ada Lovelace, TUF-RTX4070-O12G-GAMING	752,55	False	https://www.amazon.it/ASUS-GeForce-Grafica-Lovelace-TUF-RTX4070-O12G-GAMING/dp/B0BVMM9VB1/ref=sr_1_31?keywords=gpu&qid=1699106662&sr=8-31	4,5	63
ASUS DUAL NVIDIA GeForce RTX 4060 Ti OC Edition Scheda Grafica, 16 GB GDDR6 128-bit, OpenGL 4.6, 18 Gbps PCIE 4.0, HDMI, DisplayPort, GPU Tweak III, DUAL-RTX4060TI-O16G	517,13	False	https://www.amazon.it/ASUS-GeForce-Grafica-DisplayPort-DUAL-RTX4060TI-O16G/dp/B0CC33B3PZ/ref=sr_1_32?keywords=gpu&qid=1699106662&sr=8-32	5,0	2
Aairhut Thermal Pad 13W/MK Cuscinetti Termici, 85x45x1mm Silicone Cooling Pad GPU Resistenza al Calore Non conduttiva Extreme Odyssey Cover con Dual Film Autoadesivi	7,99	False	https://www.amazon.it/Aairhut-Cuscinetti-Resistenza-conduttiva-Autoadesivi/dp/B09XJVBPQ1/ref=sr_1_37?keywords=gpu&qid=1699106662&sr=8-37	4,6	218
GIGABYTE VGA AMD RX 6600 EAGLE 8G	217,00	True	https://www.amazon.it/GIGABYTE-VGA-AMD-6600-EAGLE/dp/B09JCKJ2G9/ref=sr_1_38?keywords=gpu&qid=1699106662&sr=8-38	4,3	325
EZDIY-FAB Scheda Grafica GPU Brace 5V 3Pin ARGB,Supporto Della Scheda Video Sag Holder Holster Bracket,Alluminio Anodizzato (Nero)	21,99	False	https://www.amazon.it/EZDIY-FAB-Grafica-Supporto-Alluminio-Anodizzato/dp/B08TBR276G/ref=sr_1_39?keywords=gpu&qid=1699106662&sr=8-39	4,4	97
Uyubao Supporto Scheda Grafica GPU, Supporto Scheda Video, Supporto GPU, M(50mm-80mm)	7,90	False	https://www.amazon.it/Uyubao-Supporto-Scheda-Grafica-50mm-80mm/dp/B0CBTZVR3Y/ref=sr_1_40?keywords=gpu&qid=1699106662&sr=8-40	4,6	116
ASUS TUF Gaming GeForce RTX 4080 O16G OC Scheda Grafica Gaming, OpenGL 4.6, 16 GB GDDR6X, PCIe 4.0, HDMI 2.1a, DisplayPort 1.4a, GPU Tweak III, Nero	1.407,38	False	https://www.amazon.it/ASUS-Gaming-GeForce-Grafica-DisplayPort/dp/B0BJQPQDSM/ref=sr_1_41?keywords=gpu&qid=1699106662&sr=8-41	4,3	266
maxsun AMD Radeon RX 580 8GB 2048SP GDDR5 Computer Video Scheda Grafica GPU per PC Gaming 256-Bit DirectX 12 DVI, HDMI, DisplayPort Multi Monitor Extend (nero)	132,99	False	https://www.amazon.it/maxsun-RX-580-2048SP-DisplayPort/dp/B0BY1GHRDV/ref=sr_1_42?keywords=gpu&qid=1699106662&sr=8-42	4,2	94
Maxsun GEFORCE GT 1030, Scheda grafica dal design mini ITX, GPU GDDR4 4 GB, HDMI, DVI-D, con sistema di raffreddamento monoventola	119,99	True	https://www.amazon.it/MAXSUN-GEFORCE-GT-1030-Raffreddamento/dp/B08ZCHF59L/ref=sr_1_43?keywords=gpu&qid=1699106662&sr=8-43	4,1	219
ASUS NVIDIA GeForce GT 730 PCIe 2.0, Memoria DDR3 2 GB, Design a Slot Singolo, Auto-Extreme, GPU Tweak II, Nero	79,74	True	https://www.amazon.it/ASUS-GeForce-Carte-Graphique-Profil/dp/B0B6FT5V2B/ref=sr_1_44?keywords=gpu&qid=1699106662&sr=8-44	4,8	6
ASUS Nvidia GeForce RTX 3060, Scheda Grafica, Nero, Full-Height/Full-Length (FH/FL)	377,89	True	https://www.amazon.it/Nvidia-GeForce-Grafica-Full-Height-Full-Length/dp/B0966689N3/ref=sr_1_45?keywords=gpu&qid=1699106662&sr=8-45	4,6	585
MSI Radeon RX 6600 MECH 2X 8G Scheda video gaming - 8GB GDDR6, 2491 MHz, PCI Express 4 x 8, 128-bit, 3x DP v 1.4a, HDMI 2.1 (Supporta 4K & 8K)	253,00	True	https://www.amazon.it/MSI-Radeon-6600-Scheda-video/dp/B09GW3XN7K/ref=sr_1_46?keywords=gpu&qid=1699106662&sr=8-46	4,3	1.569
Scheda Video MAXSUN AMD Radeon RX 550 Basso Profilo 4GB GDDR5 sff Computer PC Gaming Video Scheda grafica GPU 128-Bit DirectX 12 PCI Express X16 3.0, HDMI, DisplayPort	129,99	True	https://www.amazon.it/RX-550-Profilo-Computer-DisplayPort/dp/B09SKZSDRT/ref=sr_1_47?keywords=gpu&qid=1699106662&sr=8-47	4,2	148
EVGA TARJETA GRAFICA 6GB GDDR6 GEFORCE RTX 2060 KO ULTRA GAMING 06G-P4-2068-KR	369,88	False	https://www.amazon.it/EVGA-TARJETA-GRAFICA-GEFORCE-06G-P4-2068-KR/dp/B083JX52VG/ref=sr_1_48?keywords=gpu&qid=1699106662&sr=8-48	4,5	1.046
Asus ROG Strix NVIDIA GeForce RTX 3090 White OC Edition Scheda Grafica, 24GB GDDR6X 384-bit 19 Gbps PCIE 4.0, GPU NVIDIA Ampere, ROG-STRIX-RTX3090-O24G-WHITE	3.251,73	True	https://www.amazon.it/ASUS-GeForce-Grafica-384-bit-ROG-STRIX-RTX3090-O24G-WHITE/dp/B08P94FVLV/ref=sr_1_49?keywords=gpu&qid=1699106662&sr=8-49	4,3	29
Asus ROG Strix LC NVIDIA GeForce RTX 3080 Ti OC Edition Scheda Grafica, 12 GB GDDR6X, PCIe 4.0, HDMI 2.1, DisplayPort 1.4a, Raffreddamento a Liquido, PSU Consigliata 850W, RGB, GPU Tweak II, Nero		False	https://www.amazon.it/ASUS-GeForce-DisplayPort-Raffreddamento-Consigliata/dp/B096KY13Q7/ref=sr_1_50?keywords=gpu&qid=1699106662&sr=8-50	4,3	4
HHCJ6 Dell NVIDIA Tesla K80 24 GB GDDR5 PCI-E 3.0 Server GPU Acceleratore (rinnovato)	89,00	False	https://www.amazon.it/HHCJ6-Dell-NVIDIA-Acceleratore-rinnovato/dp/B07GJ45V3D/ref=sr_1_51?keywords=gpu&qid=1699106662&sr=8-51	3,8	82
ASUS DUAL NVIDIA GeForce RTX 4060 OC Edition White Scheda Grafica, 8 GB GDDR6 128-bit 17 Gbps PCIE 4.0, GPU Tweak III, DUAL-RTX4060-O8G-WHITE	363,00	False	https://www.amazon.it/ASUS-GeForce-Grafica-128-bit-DUAL-RTX4060-O8G-WHITE/dp/B0C9TM6568/ref=sr_1_52?keywords=gpu&qid=1699106662&sr=8-52	4,4	4
ASUS NVIDIA GeForce GT 730, Scheda Grafica, 2GB GDDR5, PCIe 2.0, HDMI, DVI, D-Sub, Supporta Fino a 3 Monitor, Design a due Slot, Ridotto Consumo Energetico, GPU Tweak II, Blu/Nero	80,67	True	https://www.amazon.it/GeForce-Grafica-Supporta-Monitor-Energetico/dp/B01A9GJ55K/ref=sr_1_53?keywords=gpu&qid=1699106662&sr=8-53	4,4	809
EZDIY-FAB Supporto Verticale per GPU PCIe 4.0 con Modulo LED ARGB 5V 3Pin,kit di Supporto per Schede Video con Cavo Riser Bianco PCIe 4.0 X16 Gen4 da 17cm/6,69inch ad Angolo Retto di 90 Gradi-Bianco	72,99	True	https://www.amazon.it/EZDIY-FAB-Supporto-Verticale-Modulo-Gradi-Bianco/dp/B0BXNC692S/ref=sr_1_54?keywords=gpu&qid=1699106662&sr=8-54	4,5	39
Fasgear Cavo di alimentazione PCIe 5.0 GPU manicotto 70 cm | Connettore 16pin (12+4) 12VHPWR per RTX 3090 Ti 4080 4090 | 3x8pin (6+2) PCI-e maschio spine compatibili per ASUS EVGA Seasonic modulare	37,98	True	https://www.amazon.it/Fasgear-alimentazione-manicotto-Connettore-compatibili/dp/B0BN1F9HJX/ref=sr_1_55?keywords=gpu&qid=1699106662&sr=8-55	4,5	331
PELADN AMD Radeon RX 580 8 GB, Scheda grafica gaming per giochi e mining di criptovaluta, 30 mh/s, 3 porte DP, 1 porta HDMI, GDDR5, Bus 256 bit, GPU Ellesmere, basso consumo 130 W (Gaming)	148,75	True	https://www.amazon.it/Grafica-Multimediali-Editing-Ellesmere-consumo/dp/B0B1QTMN6G/ref=sr_1_56?keywords=gpu&qid=1699106662&sr=8-56	4,1	96
Schede Grafiche AMD per Radeon HD7670, 4GB GDDR5 Computer PC Gaming Video GPU Scheda Grafica, 128-Bit, Supporto DirectX 11 PCI Express X16 2.1 DVI, HDMI, VGA	51,53	False	https://www.amazon.it/sspa/click?ie=UTF8&spc=MToyMDQ0NDk1Mzk5MzgxNjcyOjE2OTkxMDY2NjI6c3BfYXRmOjIwMDk1MTQzMzY1Mzk4OjowOjo&url=%2FGrafiche-Computer-Grafica-128-Bit-Supporto%2Fdp%2FB0BGM23YML%2Fref%3Dsr_1_1_sspa%3Fkeywords%3Dgpu%26qid%3D1699106662%26sr%3D8-1-spons%26sp_csd%3Dd2lkZ2V0TmFtZT1zcF9hdGY%26psc%3D1	3,1	19
Ocnvlia HD6770 PCIE X16 PCI-E 2.0 Scheda Grafica Discreta GPU 1GB GDDR5 Scheda Video VGA DVI Un 128 Bit per AMD Radeon HD6770	110,21	True	https://www.amazon.it/sspa/click?ie=UTF8&spc=MToyMDQ0NDk1Mzk5MzgxNjcyOjE2OTkxMDY2NjI6c3BfYXRmOjMwMDAxOTcyOTI1ODczMjo6MDo6&url=%2FOcnvlia-HD6770-PCIE-X16-PCI%2Fdp%2FB0B7VPFWDZ%2Fref%3Dsr_1_2_sspa%3Fkeywords%3Dgpu%26qid%3D1699106662%26sr%3D8-2-spons%26sp_csd%3Dd2lkZ2V0TmFtZT1zcF9hdGY%26psc%3D1	3,0	3
QTHREE Scheda grafica AMD Radeon RX 550, 4 GB, GDDR5, 128 Bit, scheda video da gioco desktop per PC, PCI Express 3.0 X8, DirectX 12, GPU per computer, DisplayPort, HDMI, DVI-D Dual Link	99,99	True	https://www.amazon.it/sspa/click?ie=UTF8&spc=MToyMDQ0NDk1Mzk5MzgxNjcyOjE2OTkxMDY2NjI6c3BfYXRmOjMwMDA0MTgyMTU5NjYzMjo6MDo6&url=%2FSAPLOS-Radeon-RX-550-computer%2Fdp%2FB09PYHXPTQ%2Fref%3Dsr_1_3_sspa%3Fkeywords%3Dgpu%26qid%3D1699106662%26sr%3D8-3-spons%26sp_csd%3Dd2lkZ2V0TmFtZT1zcF9hdGY%26psc%3D1	4,3	22
Pvczool Scheda grafica GT210 1GB DDR2 64 bit PCIE 2.0 GPU Scheda Video Desktop DVI VGA Compatibile	39,94	True	https://www.amazon.it/sspa/click?ie=UTF8&spc=MToyMDQ0NDk1Mzk5MzgxNjcyOjE2OTkxMDY2NjI6c3BfYXRmOjMwMDAyMjI2OTE4MTczMjo6MDo6&url=%2FPvczool-Scheda-grafica-Desktop-Compatibile%2Fdp%2FB0BQHZ59XM%2Fref%3Dsr_1_4_sspa%3Fkeywords%3Dgpu%26qid%3D1699106662%26sr%3D8-4-spons%26sp_csd%3Dd2lkZ2V0TmFtZT1zcF9hdGY%26psc%3D1		
HP AMD FirePro 2270 NVIDIA QUADRO RTX5000 16GB CTLR	1.719,00	False	https://www.amazon.it/sspa/click?ie=UTF8&spc=MToyMDQ0NDk1Mzk5MzgxNjcyOjE2OTkxMDY2NjI6c3BfbXRmOjIwMTQxNDI2NjQ1NDk4OjowOjo&url=%2FHP-NVIDIA-Quadro-5000-16GB%2Fdp%2FB07PJSNX3F%2Fref%3Dsr_1_33_sspa%3Fkeywords%3Dgpu%26qid%3D1699106662%26sr%3D8-33-spons%26sp_csd%3Dd2lkZ2V0TmFtZT1zcF9tdGY%26psc%3D1	4,7	2
CINNANI Supporto scheda grafica, Staffa per GPU 50-80MM, Staffa di Supporto in lega di alluminio e magnesio Nero, Supporto Scheda Video, GPU Stütze Bracke	14,88	False	https://www.amazon.it/sspa/click?ie=UTF8&spc=MToyMDQ0NDk1Mzk5MzgxNjcyOjE2OTkxMDY2NjI6c3BfbXRmOjMwMDA4MDAyNTE0MTYzMjo6MDo6&url=%2FCINNANI-Supporto-grafica-alluminio-magnesio%2Fdp%2FB0CC2RP2RC%2Fref%3Dsr_1_34_sspa%3Fkeywords%3Dgpu%26qid%3D1699106662%26sr%3D8-34-spons%26sp_csd%3Dd2lkZ2V0TmFtZT1zcF9tdGY%26psc%3D1	4,7	21
EKWB Kit di disconnessione rapida GPU EK-Pro	135,30	False	https://www.amazon.it/sspa/click?ie=UTF8&spc=MToyMDQ0NDk1Mzk5MzgxNjcyOjE2OTkxMDY2NjI6c3BfbXRmOjIwMTI0MzQ5MzIyMDk4OjowOjo&url=%2FEKWB-EK-Pro-Kit-disconnessione-rapida%2Fdp%2FB0855BBLPM%2Fref%3Dsr_1_35_sspa%3Fkeywords%3Dgpu%26qid%3D1699106662%26sr%3D8-35-spons%26sp_csd%3Dd2lkZ2V0TmFtZT1zcF9tdGY%26psc%3D1	5,0	3
Gintai - Cavo di Alimentazione per Scheda Grafica CPU 8 Pin Maschio a Doppio PCIe 8 Pin Femmina, Ricambio per NVIDIA Tesla K80/M40/M60/P40/P100 030-0571-000 (10 cm)	14,98	False	https://www.amazon.it/sspa/click?ie=UTF8&spc=MToyMDQ0NDk1Mzk5MzgxNjcyOjE2OTkxMDY2NjI6c3BfbXRmOjMwMDAyNzUwMzExMzczMjo6MDo6&url=%2FGintai-alimentazione-scheda-grafica-030-0571-000%2Fdp%2FB086BRVW34%2Fref%3Dsr_1_36_sspa%3Fkeywords%3Dgpu%26qid%3D1699106662%26sr%3D8-36-spons%26sp_csd%3Dd2lkZ2V0TmFtZT1zcF9tdGY%26psc%3D1	4,8	12
SISS Ventola di raffreddamento per schede grafiche XFX RX 590 580 570 95 mm CF1010U12S GPU Cooler Fan for Graphics Card Cooling	19,99	False	https://www.amazon.it/sspa/click?ie=UTF8&spc=MToyMDQ0NDk1Mzk5MzgxNjcyOjE2OTkxMDY2NjI6c3BfYnRmOjMwMDA1NDI0NTg3NjMzMjo6MDo6&url=%2FVentola-raffreddamento-grafiche-CF1010U12S-Graphics%2Fdp%2FB09BXY8N5Y%2Fref%3Dsr_1_57_sspa%3Fkeywords%3Dgpu%26qid%3D1699106662%26sr%3D8-57-spons%26sp_csd%3Dd2lkZ2V0TmFtZT1zcF9idGY%26psc%3D1	4,1	22
EKWB Piastra posteriore attiva della GPU di Strix RTX 3080/3090 di EK-Quantum, acetale	169,99	False	https://www.amazon.it/sspa/click?ie=UTF8&spc=MToyMDQ0NDk1Mzk5MzgxNjcyOjE2OTkxMDY2NjI6c3BfYnRmOjIwMTI0MzQ5MzIwMDk4OjowOjo&url=%2FEKWB-EK-Quantum-Vector-Active-Acetale%2Fdp%2FB09C552511%2Fref%3Dsr_1_58_sspa%3Fkeywords%3Dgpu%26qid%3D1699106662%26sr%3D8-58-spons%26sp_csd%3Dd2lkZ2V0TmFtZT1zcF9idGY%26psc%3D1	4,8	9
KtbeYTi Supporto per Scheda Grafica in Alluminio Supporto in Alluminio per Scheda Video Nero Supporto GPU Altezza Regolabile per 73-120 mm di Altezza, per Tenere la Scheda Grafica in Posizione	7,99	False	https://www.amazon.it/sspa/click?ie=UTF8&spc=MToyMDQ0NDk1Mzk5MzgxNjcyOjE2OTkxMDY2NjI6c3BfYnRmOjIwMTA2MzQ1MTM1MDk4OjowOjo&url=%2FKtbeYTi-Alluminio-GPU-Regolabile-Posizione%2Fdp%2FB0BN3QHWBX%2Fref%3Dsr_1_59_sspa%3Fkeywords%3Dgpu%26qid%3D1699106662%26sr%3D8-59-spons%26sp_csd%3Dd2lkZ2V0TmFtZT1zcF9idGY%26psc%3D1	4,2	28
PCIE Riser Card 8 condensatori, GPU Extender Riser Card per Bitcoin Litecoin ETH Ethereum Mining, con cavo di prolunga USB 3.0 da 60 cm e cavo di alimentazione SATA 6PIN (V009s-PLUS, 2 pezzi)	18,99	False	https://www.amazon.it/sspa/click?ie=UTF8&spc=MToyMDQ0NDk1Mzk5MzgxNjcyOjE2OTkxMDY2NjI6c3BfYnRmOjIwMDMwMjAxNTE3MTk4OjowOjo&url=%2Fcondensatori-Extender-Litecoin-alimentazione-V009s-PLUS%2Fdp%2FB09M38G7Z5%2Fref%3Dsr_1_60_sspa%3Fkeywords%3Dgpu%26qid%3D1699106662%26sr%3D8-60-spons%26sp_csd%3Dd2lkZ2V0TmFtZT1zcF9idGY%26psc%3D1	4,3	119
Asus Dual GeForce RTX 2060 EVO OC Edition Scheda Grafica, 12GB GDDR6, PCIe 3.0, HDMI, DisplayPort, DVI, Due Ventole Axial-Tech, Tecnologia 0dB, Auto Extreme, PSU Consigliata 500W, GPU Tweak II, Nero	351,93	False	https://www.amazon.it/ASUS-DisplayPort-Axial-Tech-Tecnologia-Consigliata/dp/B09N9C9F1S/ref=sr_1_53?keywords=gpu&qid=1699106764&sr=8-53	4,6	418
Scheda Video MAXSUN AMD Radeon RX 550 Scheda Grafica 4GB GDDR5 ITX per computer PC, Gaming, Video, GPU 128-bit DirectX 12 PCI Express X16 3.0 DVI-D Dual Link, HDMI, DisplayPort	119,99	True	https://www.amazon.it/MAXSUN-RX-550-Computer-DisplayPort/dp/B08VHWFWSD/ref=sr_1_54?keywords=gpu&qid=1699106764&sr=8-54	4,2	1.080
EZDIY-FAB Cavo con Manicotto PCIE 6+2 Pin,Cavi con Manicotto GPU,Prolunga per Alimentazione Elettrica-Nero	8,99	False	https://www.amazon.it/EZDIY-FAB-Manicotto-Prolunga-Alimentazione-Elettrica-Nero/dp/B08KT5QXF6/ref=sr_1_55?keywords=gpu&qid=1699106764&sr=8-55	4,4	58
ASUS TUF Gaming NVIDIA GeForice RTX 3070 V2 OC Edition Scheda Grafica, 8GB GDDR6, PCIe 4.0, HDMI 2.1, DisplayPort 1.4a, GPU Tweak II, Componenti di Livello Militare, LHR		False	https://www.amazon.it/ASUS-GeForice-DisplayPort-Consigliata-Componenti/dp/B097TCX8QL/ref=sr_1_56?keywords=gpu&qid=1699106764&sr=8-56	4,7	168
ASUS NVIDIA GeForce GT 710 Scheda grafica PCIe 2.0, Memoria DDR3 2 GB, Raffreddamento Passivo, Auto-Extreme, GPU Tweak III, Grigio	51,90	False	https://www.amazon.it/ASUS-grafica-GeForce-profilo-silenzioso/dp/B0B7XRYLVT/ref=sr_1_57?keywords=gpu&qid=1699106764&sr=8-57	4,3	405
ASUS TUF Gaming NVIDIA GeForce RTX 4070 Ti OC Edition Scheda Grafica, 12GB GDDR6X 192-bit 21 Gbps PCIE 4.0, GPU NVIDIA Ampere, TUF-RTX4070TI-O12G-GAMING	983,50	False	https://www.amazon.it/ASUS-GeForce-Grafica-192-bit-TUF-RTX4070TI-O12G-GAMING/dp/B0BNW6598Y/ref=sr_1_58?keywords=gpu&qid=1699106764&sr=8-58	4,5	113
ASUS TUF Gaming NVIDIA GeForce GTX 1650 V2 OC Edition Scheda Video Gaming GDDR6 4GB, PCIe 3.0, HDMI, DisplayPort, Design Compatto, GPU Tweak III, Nero	189,96	True	https://www.amazon.it/ASUS-Gaming-GeForce-DisplayPort-Compatto/dp/B0BPYXD75L/ref=sr_1_59?keywords=gpu&qid=1699106764&sr=8-59	4,5	468
LINKUP - AVA 50cm PCI-e 8 (6+2) pin GPU Cavo di Prolunga per PC Personalizzato con Guaina Intrecciata per Alimentatore PSU con Pettini┃Design Robusto e Rigido┃Confezione Singola┃500mm - Bianca	13,95	False	https://www.amazon.it/LINKUP-PCI-Alimentatore-Personalizzato-Pettine%E2%94%83Confezione/dp/B08CFTJQNB/ref=sr_1_60?keywords=gpu&qid=1699106764&sr=8-60	4,6	23
ASUS NVIDIA GeForce RTX 4080 Noctua OC Edition Scheda Grafica, 16 GB GDDR6X 256-bit 22,4 Gbps PCIE 4.0, GPU Tweak III, RTX4080-O16G-NOCTUA	1.739,99	False	https://www.amazon.it/ASUS-GeForce-Grafica-256-bit-RTX4080-O16G-NOCTUA/dp/B0BZ1QHDHZ/ref=sr_1_61?keywords=gpu&qid=1699106764&sr=8-61	4,5	5
Vaizdo plokštÄ— Grafikos plokštÄ—|PALIT|NVIDIA GeForce RTX 4080|16 GB|GDDR6X|256 bit|PCIE 4.0 16x|GPU 2205 MHz|1xHDMI|3xDisplayPort|NED4080S19T2-1030G	1.439,51	True	https://www.amazon.it/plok%C5%A1t%C3%84-Grafikos-GeForce-3xDisplayPort-NED4080S19T2-1030G/dp/B0BJZXQZ9J/ref=sr_1_62?keywords=gpu&qid=1699106764&sr=8-62	4,6	24
ASUS TUF Gaming NVIDIA GeForce RTX 4060 Ti OC Edition Scheda Grafica, 8 GB GDDR6 128-bit 18 Gbps PCIE 4.0, GPU Tweak III, TUF-RTX4060TI-O8G-GAMING	512,15	False	https://www.amazon.it/VGA-Asus-RTX4060TI-8GB-TUF/dp/B0BRYY1JX8/ref=sr_1_63?keywords=gpu&qid=1699106764&sr=8-63	5,0	12
Uyubao NVIDIA GeForce RTX 3090 Supporto Scheda Video, Supporto Scheda Grafica GPU, Supporto GPU, Alluminio aerospaziale anodizzato, L(70mm-120mm)	8,90	False	https://www.amazon.it/Uyubao-Alluminio-aerospaziale-anodizzato-70mm-120mm/dp/B0BHZGT2FY/ref=sr_1_64?keywords=gpu&qid=1699106764&sr=8-64	4,6	394
MSI MPG A850G PCIE5, Alimentatore 850W, certificato 80 Plus Gold, ATX 3.0 100% modulare, supporto GPU PCIe 5.0, 105°C condensatori giapponesi, 0% RPM Mode, cavi piatti - 10 anni di garanzia	139,10	True	https://www.amazon.it/MSI-Alimentatore-certificato-condensatori-giapponesi/dp/B0B4345YV7/ref=sr_1_65?keywords=gpu&qid=1699106764&sr=8-65	4,8	1.635
ASUS TUF Gaming NVIDIA GeForce RTX 3070 Ti OC Edition V2 Scheda Grafica Gaming, OpenGL 4.6, 8 GB GDDR6, PCIe 4.0, HDMI 2.1a, DisplayPort 1.4a, GPU Tweak III, Nero	549,58	False	https://www.amazon.it/ASUS-Gaming-GeForce-Grafica-DisplayPort/dp/B0BNNG8H6B/ref=sr_1_66?keywords=gpu&qid=1699106764&sr=8-66	4,4	66
ASUS Dual NVIDIA GeForce RTX 3050 OC Edition Scheda Grafica, 8GB GDDR6, PCIe 4.0, HDMI 2.1, DisplayPort 1.4a, Due Ventole Axial-Tech, PSU Consigliata 550W, GPU Tweak II, Tecnologia 0dB, LHR	317,20	False	https://www.amazon.it/GeForce-DisplayPort-Axial-Tech-Consigliata-Tecnologia/dp/B09QMG6FZX/ref=sr_1_67?keywords=gpu&qid=1699106764&sr=8-67	4,4	524
ASUS Dual Nvidia GeForce RTX 2060 6GB EVO Gaming Scheda Grafica, 6GB GDDR6 192-bit PCIE 4.0, GPU NVIDIA Ampere	307,00	True	https://www.amazon.it/ASUS-Nvidia-GeForce-Grafica-192-bit/dp/B07V32M9SQ/ref=sr_1_68?keywords=gpu&qid=1699106764&sr=8-68	4,6	306
ASUS ProArt NVIDIA GeForce RTX 4080 OC Edition Scheda Grafica, 16 GB GDDR6X 256-bit 22,4 Gbps PCIE 4.0, GPU Tweak III, PROART-RTX4080-O16G	1.425,74	False	https://www.amazon.it/ASUS-GeForce-Grafica-256-bit-PROART-RTX4080-O16G/dp/B0C478WQF5/ref=sr_1_69?keywords=gpu&qid=1699106764&sr=8-69	5,0	3
SAPLOS GTX 1050 Ti Scheda Video, 4GB, 128 Bit, GDDR5, DisplayPort HDMI DVI, Schede Grafiche, Computer GPU, Video Cards for PC Gaming, PCI Express x16 3.0, DirectX 12, Support 8K Displays	189,99	True	https://www.amazon.it/SAPLOS-GTX-1050-Ti-DisplayPort/dp/B09Q8YPJ2V/ref=sr_1_70?keywords=gpu&qid=1699106764&sr=8-70	4,8	8
PNY NVIDIA Quadro RTX 4000 - La prima GPU Ray Tracing al mondo	1.200,00	False	https://www.amazon.it/PNY-QUADRO-4000-Scheda-Grafica/dp/B07P6CDHS5/ref=sr_1_71?keywords=gpu&qid=1699106764&sr=8-71	4,5	182
EZDIY-FAB RGB Scheda Grafica, GPU Colorato Supporto Scheda Video, Sag Titolare Staffa 5V a 3 Pin	19,99	False	https://www.amazon.it/EZDIY-FAB-Grafica-Colorato-Supporto-Titolare/dp/B07X8P71WQ/ref=sr_1_72?keywords=gpu&qid=1699106764&sr=8-72	4,3	1.233
ASUS DUAL NVIDIA GeForce RTX 3060 OC Edition Scheda Grafica Gaming, OpenGL 4.6, 8 GB GDDR6, PCIe 4.0, HDMI 2.1a, DisplayPort 1.4a, GPU Tweak II, Bianco	346,68	True	https://www.amazon.it/ASUS-NVIDIA-GeForce-Grafica-DisplayPort/dp/B0BLFDWGKH/ref=sr_1_73?keywords=gpu&qid=1699106764&sr=8-73	4,6	28
